{
  "conversation_id": "668320d2-2fd8-4888-b33c-2a466fec86e7",
  "generation_id": "490b90b7-a2ce-4c2c-bb76-cb77b125df2f",
  "model": "claude-opus-4-7-thinking-max",
  "model_id": "claude-opus-4-7",
  "model_params": [
    {
      "id": "thinking",
      "value": "true"
    },
    {
      "id": "effort",
      "value": "max"
    }
  ],
  "hook_event_name": "beforeMCPExecution",
  "cursor_version": "1.7.2",
  "workspace_roots": [
    "/home/user/project"
  ],
  "user_email": null,
  "transcript_path": null,
  "tool_name": "create_issue",
  "tool_input": "{\"title\":\"Flaky test\"}",
  "mcp_server_name": "linear",
  "url": "https://mcp.linear.app/sse",
  "mcp_server_url": "https://mcp.linear.app/sse"
}
